addon_id,addon_title,addon_short_info
cgpmaldjmbpieenobjmjpokdjfihhple,LikeButton.eth,A decentralised like button 
hbhjcmcbihinkdghhbhcgoediddnimdp,WEBZEN Starter,크롬 브라우저에서 WEBZEN 게임 서비스를 원활하게 실행할 수 있도록 도와줍니다
fpoogajipcflldljhmfagmdeajppbbnn,65Buy Shopping Mate,在您逛淘宝 天猫的同时 可以直接添加商品到65buy的购物车或提交转运订单寄送海外 
nibcfhoddalbjppdfembfnmjcjpcicji,Markdown Preview for Tildes,Simple extension which displays markdown live preview on Tildes
gojhmiglfjmejnljfnlmojcnmknejaji,Maor Berezinski,
anomfnechipjfoojdadjhbaooimahplf,Vyhledávač spojení IDS JMK,Vaše oblíbené spoje na jedno kliknutí
kpaieaipaobofbkjmgajjceodpmldofi,Proposo,Easily customize your proposal to fit the job requirements and make it stand out from the competition 
mbjbkpcdllgeipimampcmdlnkjndfiba,Light Blue Material,Light blue theme inspired by Google Material Design standards
ojnkdanfbijpkkgkebmbpfkgfphdmljb,in-tel-ex,redirecting from the former news site to telex hu
ennkgpoidlcphlccokdocigfibidmccj,Tab Preview Board,You can switch tabs with seeing their previews
jhiggndhadjkkagjekjmkbnbgnmljnfi,QR Power,This extension generates a QR code for the current page
akaeanmingfpniomcfbdjklhnkcfchmm,Priberam.pt right click search,Searches selected text on priberam pt
jblgpemdpeplkdmkgfggacgfdaofjpjh,Vocabulary Anki Memo,Quick English vocabulary search history anki memo
hcfofmfmidhgbblcnnipcphhegcmdeeb,HF Xtension,Enhance your HF Experience 
jkgdnpkheecebmchhpgoiacpmgmiiign,Corona virus. Covid-19. Microscope,Corona virus Covid 19 Pandemia If you like this theme  will rate it  please Website https gctheme store 
ojdpohidmbnojbdkmlgofjhogpkbimio,MazdaKlan.cz blue,Mazdaklan blue Chrome theme Dedicated to all fans of Mazda 
apbhlcjhnobgbphdiafbanflicbifkho,Different font,If you like this theme  will rate it  please Website https gctheme store 
iejcdmcgelpioejdpeoifnaemneihagc,ProfCheck,View Rate My Professors ratings directly in your course explorer 
hofngheikljnkeimmabnfoglecepdhfj,Annotator,Add bookmark and note inside pages
coljiklkklefeblhcmmldhmmjepmjhhg,Jeff Goldblum's Throne,dont make jeff angry
daepoakiopepeflefoedcpgoenpaiine,Apex Legends Map Updates,For Apex Gamers By Apex gamer  It s In The Game
bmcnjpgbhlegnmpmphhfealchlfifepj,Dojima Wallet Extension,Dojima Wallet helps to manage Multiple Chain Native  Non Native Tokens Their Services From A Single Place 
baophhpapgpfpbpgfnpedkdikedlkion,СloudMania.com.ua,Cloud Mania не просто вейп шоп  а настоящий рай для вейперов
lgbpajbkpmhngginifmlaenlhmlpllhl,ChatGPT Extension,Sends selected text to ChatGPT API
dbamcgjghlobpojjecgbmdhohihklfjg,SmartOUTLOOK NXT,Allows quick email to action recording in Raiser s Edge NXT
gnbecgmjnbejfmikimdcbdjhlgcooehl,PhönixDeal - Deals und Schnäppchen,Top Schnäppchen  Amazon Angebote Gratisproben Bei uns findest du täglich die besten Deals Gutscheine
dcephjdbkdlehhciidggdapfepecohah,Mad Max 2 - Wez,Mad Max Road Warrior Wez
nkaobdiddialkfpbfokcdbobiejpjfgg,Mua Tài Khoản Facebook,Di ch vu mua ba n tài khoản facebook  mua nick acc facebook gia re uy ti n đê ba n ha ng online
fihnjjcciajhdojfnbdddfaoknhalnja,I don't care about cookies,Remove annoying cookie warnings from almost all infected websites The EU regulations require that any website using cookies 
gjoimbbkllocghfkbjdfjeakcgnkglgd,VisiOS - Tab / Bookmark Manager OS,The Legendary Tab Bookmark Manager OS
hbnlgiejkipfailhdfcgnneeehcpdapo,Bogenschießen Spiele,Kommen Sie und erleben Bogenschießen Spiele  traditionelle Spiele des Bogenschießens revolutioniert und Völkerball mit besonderen 
fefnkplkicihcoenmljhbihhaaagjhpp,Mino (früher Minty) - Automatische Coupons,Mino früher Minty Das perfekte Online Tool für Automatische Coupons  Cashback  Preisvergleiche in Deutschland
bmdjemeegkdpfbmcegjffenfjcbjhdko,Belarusian flag,If you like this theme  will rate it  please Website https gctheme store 
knllljbjfcglhmmallcepjkompkkiend,Waves,Nur die besten und beliebtesten Themen von Atavi com
gknnkdgbbkjpnibhdjoggkbboaidmnap,meinereisedaten TV,Mit myJACK und meinereisedaten TV erstellen Sie in wenigen Arbeitsschritten Angebote  die in dieser App automatisch in einer 
eganmcnmggbegnocpaiblejahdjifgho,Attack On Titan Eloquence  1920X1080,Attack On Titan Eloquence 1920X1080
